[
  {
    "settlement_id": "BIS-2026-001",
    "company": "Applied Materials (subsidiary)",
    "agency": "BIS",
    "amount_usd": 252000000,
    "date": "2026-02-01",
    "export_mechanics": ["Unlicensed shipment of semiconductor manufacturing equipment to China", "Failure to obtain required export licence for items controlled under 3B001"],
    "cyber_nexus": null,
    "regulation_cited": ["15 CFR Part 764", "15 CFR Part 742 (National Security Controls)", "ECCN 3B001"],
    "eccn": ["3B001"],
    "source_url": "https://www.bis.gov/press-release/applied-materials",
    "enforcement_type": "Civil penalty",
    "status": "Final",
    "penalty_trend": "Escalating",
    "notes": "Largest BIS civil penalty for semiconductor equipment to China as of date. Involved shipments routed through intermediaries. Populate from BIS press release and order."
  },
  {
    "settlement_id": "BIS-2025-002",
    "company": "Cadence Design Systems",
    "agency": "BIS",
    "amount_usd": 0,
    "date": "2025-01-01",
    "export_mechanics": ["Deemed export violation — foreign national employees in US accessed controlled EDA software tools (ECCN 3D001/5D002)", "Failure to obtain deemed-export licences for access to controlled technology"],
    "cyber_nexus": "Foreign-national employee access to controlled design tools constitutes deemed export under EAR §734.13; internal access controls insufficient",
    "regulation_cited": ["15 CFR §734.13 (deemed export)", "15 CFR §774 (CCL)", "ECCN 3D001"],
    "eccn": ["3D001", "5D002"],
    "source_url": "https://www.bis.gov/press-release/cadence-design",
    "enforcement_type": "Warning letter",
    "status": "Final",
    "penalty_trend": "Novel precedent",
    "notes": "Investigation began 2024. Settlement terms: enhanced compliance programme, annual reporting. Key precedent: EDA software deemed export. Populate from BIS order."
  },
  {
    "settlement_id": "DOJ-2025-003",
    "company": "Multiple defendants (Operation Gatekeeper)",
    "agency": "DOJ-NSD",
    "amount_usd": 0,
    "date": "2025-12-01",
    "export_mechanics": ["AI chip diversion through UAE-based hub", "Procurement network using front companies to acquire H100/H200 class GPUs for restricted end-users"],
    "cyber_nexus": "Shell company identity fabrication; digital invoice manipulation",
    "regulation_cited": ["50 U.S.C. ch. 35 (IEEPA)", "15 CFR Part 744 (Entity List/End-User Controls)", "18 U.S.C. §371 (conspiracy)"],
    "eccn": ["3A090"],
    "source_url": "https://www.justice.gov/nsd/operation-gatekeeper",
    "enforcement_type": "Criminal charge",
    "status": "Ongoing",
    "penalty_trend": "Escalating",
    "notes": "Multi-defendant criminal prosecution. UAE node identified as transshipment hub for 3A090-controlled GPUs. Populate from DOJ press releases and indictments."
  },
  {
    "settlement_id": "BIS-2026-004",
    "company": "Beijing Reciprocal Blacklist — 56 US companies",
    "agency": "Multi-agency",
    "amount_usd": 0,
    "date": "2026-01-01",
    "export_mechanics": ["Chinese countermeasure: export licence denial for rare earths and critical minerals", "Designated 56 US defence/semiconductor companies on Chinese Unreliable Entity List"],
    "cyber_nexus": null,
    "regulation_cited": ["China's Unreliable Entity List Regulations (2020)", "China's Export Control Law (2020)", "Rare Earth Export Controls (2023 amendments)"],
    "eccn": [],
    "source_url": "https://mofcom.gov.cn",
    "enforcement_type": "Entity List addition",
    "status": "Final",
    "penalty_trend": "Novel precedent",
    "notes": "Bidirectional nature of export controls. Rare earth countermeasures created supply-chain vulnerability for US semiconductor industry. Populate from MOFCOM and US government responses."
  }
]
